name,position_desc
前端工程师（电商业务）,岗位职责：1、参与公司各平台项目开发，如PC、WAP、APP等；2、根据产品需求完成高质量的Web前端开发和维护；3、优化Web前端应用，改善用户体验；4、解决Web前端页面在各浏览器的兼容性问题；5、同后端工程师紧密合作，高效地完成前后台交互的开发工作。任职要求：1、对安卓和IOS有一定的了解，有电商经验优先；2、熟悉Web开发标准，精通Web（HTML5CSS3JavaScript)，熟练使用VueReact开发框架，熟悉ES6语法，具备跨终端（MobilePC）的前端开发能力；3、精通主流前端UI组件，如ElementUIVantAnt-Design等；4、精通各主流浏览器（IE各版本、Chrome、Firefox、Safari）间的差异性，能快速定位和解决各种兼容性问题；5、掌握前端构建工具的使用，如webpack、Gulp、nodeJs、熟悉npm的使用、熟悉http协议、熟悉可视化工具的使用，如HighChartseCharts等；6、掌握前端调试、性能优化、web安全等前端技术，熟悉常见设计模式，能把良好的架构设计落地到项目实践中，掌握前端常见的多端适配和性能优化方案。
web前端开发,武汉瑞鑫智联科技有限公司公司从事电子产品、数码产品、计算机软件、技术、通信设备等电子产品的研发及销售，具备全面的IT专业服务能力，为客户提供企业级信息技术解决方案、应用软件开发和维护、质量保证和测试等服务。目前与多家中小型互联网企业形成重要战略合作伙伴，面对当今互联网化，以及云计算、大数据的挑战，公司秉承着“全面实现国家信息化建设“的宗旨，坚持“为国家为市场提供大量高端、专业、有针对性的人才”的理念。公司与华为、腾讯、美乐乐、软通动力、用友等行业巨头有着全面深入的战略合作，为客户提供全链条、高质量、高效率，具有综合优势和行业特色的技术服务型公司。同时与国内多所知名大学建立了合作。
2021招聘后台开发工程师|前端开发工程师,详见招聘简章中国（上海）自由贸易试验区川和路55弄15号点击查看地图
前端工程师（无锡）,岗位职责：1、负责前端开发工作；2、持续提升前端体验与响应速度；3、与程序开发人员密切合作，制定前后端的程序接口标准。任职要求：1、硕士学历；2、英语水平CET-4及以上；3、所学专业为计算机科学与技术、电子与计算机工程、软件工程、网络工程、通信工程、物联网工程、信息安全、智能科学与技术、数据科学与大数据技术等优先。薪资范围：均为税前年薪，15薪1.本科毕业生：税前年薪10-20W2.硕士毕业生：税前年薪13-30W3.博士毕业生：税前年薪25-40W*特别优秀的仍有上浮空间
前端工程师（常州）,岗位职责：1、负责前端开发工作；2、持续提升前端体验与响应速度；3、与程序开发人员密切合作，制定前后端的程序接口标准。任职要求：1、硕士学历；2、英语水平CET-4及以上；3、所学专业为计算机科学与技术、电子与计算机工程、软件工程、网络工程、通信工程、物联网工程、信息安全、智能科学与技术、数据科学与大数据技术等优先。薪资范围：均为税前年薪，15薪1.本科毕业生：税前年薪10-20W2.硕士毕业生：税前年薪13-30W3.博士毕业生：税前年薪25-40W*特别优秀的仍有上浮空间
软件开发工程师（中数通信息有限公司）,招聘岗位软件开发工程师工作地点广州用人单位中数通信息有限公司学历要求本科及以上专业要求信息系统、软件工程、计算机等相关专业应聘资格要求1、掌握以下一种或多种发开技术或工具：JAVA、C/C++、.NET、Python、HTML5、Web/前端、SQL、Oracle；2、具有开发项目或实习相关经验，熟练掌握开发流程；3、综合素质优秀，逻辑思维清晰，学习能力强4、态度积极主动，团队协助能力较好，良好的抗压能力。岗位职责1、参与项目/产品的需求会议，挖掘开发需求；2、开展系统功能的设计、编码开发、单元测试工作；3、编写设计文档、单元测试报告等技术类文档；4、支持售前技术服务工作、产品应用服务等。
软件开发工程师（JAVA）（广东省电信规划设计院）,招聘岗位软件研发工程师工作地点广州用人单位软件院学历要求本科及以上专业要求计算机类、信息类应聘资格要求1.了解MVC开发框架，了解Javascript/Jquery、HTML/CSS等前端开发技能；2.熟练掌握数据结构和算法，熟悉编程思想；3.熟悉常见的编码安全问题原理，熟悉基本编码规约；4.熟练掌握数据库开发知识，熟悉SQL语法；5、有良好的编程习惯和技术文档编写习惯；6、工作认真、细致，具有高度的责任心和团队精神。岗位职责1、负责软件项目的设计、开发、维护以及单元测试工作；2、负责应用系统开发过程产出文档的编写；3、协同测试人员制定研发应用系统的技术测试方案，并配合完成软件测试工作。
软件开发工程师,1.针对上级下发的任务和需求，进行技术选型，讨论比较各种选型优缺点后选择技术方案。2.针对需求选择合适数据库设计表结构，并随项目实际需求对表结构进行调整。3.开发前、后端程序实现需求，并对程序完成初步测试。4.提供接口说明文档与前端开发工程师对接，并在之后提供真实接口。5.对项目整体完成测试，提交到上线流程。6.负责前、后端项目的发布和维护。7.根据需求对项目进行迭代开发或对现有软件产品进行二次开发。浙江省台州市椒江区外沙支路100号点击查看地图
初级前端开发工程师,"产品介绍公司自研的产是面向政府、企业、行业用户的IT运维管理一站式综合监控运维平台，旨在提升大中型企业内IT运维部门的工作效率、质量、流程。产品具备标准化的功能，同时支持针对客户做一定程度的定制开发。任职要求:1.计算机相关专业,1年以上react技术开发经验（不接受应届生）；2.熟练掌握react,redux,有实际react开发项目经验；3.熟悉HTTP协议，了解TCP/IP的基本工作原理；4.了解数据结构与算法;5.了解软件设计，开发过程，开发规范以及软件质量控制，良好的编程习惯，有研究和极客精神；6、前端5，后端7人6.具备强烈的责任心，对工作有激情，良好的团队合作精神和沟通能力；有以下特点优先考虑：a)有开源作品或技术博客；b)技术社区活跃分子；c)有线上作品。工作内容：1.负责公司平台系统的设计和开发；2.负责codereview。"
JAVA工程师,暂无
H5前端开发工程师,岗位职责：1、负责前端界面的构建各类交互设计与实现；2、持续优化前端体验和页面响应速度。任职要求：1、具有H5应用开发经验，熟悉HTML、CSS、JS，有前端H5应用原生混合开发经验；2、了解MVC/MVVC模式，了解VUE、element-UI、echarts等前端框架优先；3、具备较强的责任心和协作能力。PS:仅接受通过实习转正（至少3个月）杭州市拱墅区城西银泰E座10楼点击查看地图
技术管培-前端工程师（杭州）,工作职责：1、根据UI和交互，参与前端技术方案的设计与搭建，确保代码质量；2、参与项目开发，与后端技术团队紧密合作，持续改进当前产品的前端功能，优化性能，改善用户体验；3、负责开发文档撰写，共同努力提升团队核心技术能力，赋能业务产品；4、线上紧急问题的快速响应，项目上线部署及维护工作，团队疑难问题的跟进和解决；5、完成上级领导交办的其他工作。任职要求：1、计算机及通信等相关专业；2、精通HTML+CSS，熟悉es6＼es7＼es2020等新特性；3、熟练掌握vue、React、node等开发框架，熟悉前端工程化与模块化开发;4、有脚手架开发、可视化搭建技术经验者优先；5、有开源项目开发经验者优先；6、对前端开发有浓厚的兴趣，具有快速学习能力，乐于探索，善用工具，并有良好的编码习惯。
技术管培-前端工程师（重庆）,工作职责：1、根据UI和交互，参与前端技术方案的设计与搭建，确保代码质量；2、参与项目开发，与后端技术团队紧密合作，持续改进当前产品的前端功能，优化性能，改善用户体验；3、负责开发文档撰写，共同努力提升团队核心技术能力，赋能业务产品；4、线上紧急问题的快速响应，项目上线部署及维护工作，团队疑难问题的跟进和解决；5、完成上级领导交办的其他工作。任职要求：1、计算机及通信等相关专业；2、精通HTML+CSS，熟悉es6＼es7＼es2020等新特性；3、熟练掌握vue、React、node等开发框架，熟悉前端工程化与模块化开发;4、有脚手架开发、可视化搭建技术经验者优先；5、有开源项目开发经验者优先；6、对前端开发有浓厚的兴趣，具有快速学习能力，乐于探索，善用工具，并有良好的编码习惯。
Web前端开发工程师,岗位职责：1、参与项目、产品需求分析与程序设计；2、能很好的与用户沟通，明确了解用户需求；3、学习能力强，逻辑性强，对技术有强烈的进取心，善于沟通，注重团队协作;能力要求：1、熟练掌握HTML/CSS/JavaScript等前端基础知识3、熟悉掌握VUE、React、Jquery，AnglarJs等前端主流框架；4、熟悉掌握Ajax、DOM、XML、JSON、CANVAS等相关技术，能使用原生JS编程，精通面向对象；5、熟悉各主流浏览器特点，精通前端性能调优，优化各浏览器界面显示；6、熟悉前端开发工具，熟练使用Linux，git，svn等工具。
Web前端开发工程师,【岗位职责】1、参与电磁仿真软件的开发，持续改进当前产品的功能，优化性能，改善用户体验；2、配合其他小组成员不断完善我们电磁仿真软件，修复软件出现的bug；3、参与前端框架建设，并不断优化前端工具链；4、改进协作流程，创建技术标准和规范；5、新技术(如前端三维显示)研究与应用.
Java开发工程师（中通服网络信息技术）（贵阳）,招聘岗位Java开发工程师用人单位中通服网络信息技术有限公司学历要求大学本科及以上专业要求计算机科学与技术、软件工程岗位职责1、参与概要设计，负责详细设计，并负责完成核心代码；2、根据开发规范与流程独立完成模块的设计、编码、测试以及相关文档；3、把项目需求转化为技术需求；4、能解决项目开发中遇到的难点问题，善于学习和总结；5、公司内部管理、运营支持软件的日常维护和使用培训。应聘资格要求1、java基础扎实，熟悉io、多线程、集合等基本知识；2、熟悉Web开发，熟练使用Spring、SpringMVC、JPA/Hibernate、MyBatis、SpringBoot等主流的开发框架，熟悉linux操作系统；3、熟悉SQL，熟练使用Postgresql、MySQL、Oracle等关系数据库，并具备一定的SQL优化能力；4、了解非关系型数据库，如：MongoDB，Redis，InfluxDB等。5、熟练使用Maven构建工具、IntelliJIDEA开发工具，可以使用Git等分支管理。6、熟悉SpringCloud微服务架构、Javascript、Vue等常用前端开发框架者优先；
Web前端开发实习生,岗位职责：1、承担WEB系统的界面设计和用户体验设计;2、和产品经理沟通并确定产品开发需求;3、与后台工程师紧密合作，高效地完成开发工作。4、承担主要开发工作，分析、优化性能，提高用户体验。任职要求：1、计算机或相关专业本科或以上学历，22届学生优先；；2、理解并掌握Javascript语言核心技术DOM、BOM、Ajax、JSON等，对jQuery、bootstrap等框架有一定的经验；熟悉AngularJS等mvc框架者优先；3、对前端性能优化、解决多浏览器兼容性问题有一定的经验；能手写跨浏览器、跨终端的前端代码；水岸广场东区点击查看地图
前端工程师,公司介绍：58同城，2005年12月创立于北京，并于2013年10月31日，正式于纽交所挂牌上市，2015年58同城先后完成安居客、中华英才网并购，同年11月正式合并赶集网。58同城作为中国领先的生活服务平台，旗下拥有安居客、转转、58同城到家精选、人人车、赶集网、中华英才网、58魔方、爱房、驾校一点通、58数科、58同镇、58部落，业务覆盖招聘、房产、汽车、本地生活服务等领域。58同城不断进行AI、大数据、VR可视化、智能化技术创新，完善用户服务标准化和保障体系，为客户提供更专业、高效的服务，全方位的市场营销解决方案，让用户更安心，让更多人生活简单美好。在这里，有机会做全栈式开发，做移动端开发，做性能、功能等方面的架构改进与优化！在这里，你可以美化产品线Web功能的设计！在这里，你有机会亲自参与一个产品从设计到发布的全过程！在这里，你会学习和参与业内最前沿前端技术的开发与研究！只要你，熟悉html、js、css等相关技术；只要你，对html语义化有一定的理解，精通各种浏览器兼容性技术；只要你，熟悉一种后端语言，如java、php等；只要你，关注新事物、新技术，有较强的学习能力，喜欢挑战，个性乐观开朗，逻辑性强，善于和各种背景的人合作。ComeOn，下一个“web前端工程师”就是你！投递链接：ca***com[点击查看]北京市朝阳区酒仙桥北路甲10号院105号楼点击查看地图其他职位
信息处理工程师（嵌入式）,岗位说明：1.从事通信和导航信息处理软件的设计和研究2.根据项目需求、完成信息处理软件模块高质量设计、代码编写和测试；确保软件正确性、可靠性和可维护性3.参加整机联试联调工作4.编写相关技术文档任职资格：1.掌握卫星导航或通信信息处理相关专业知识2.熟悉卫星导航或无线通信系统的原理3.熟悉嵌入式软硬件系统设计和测试方法4.熟悉嵌入式软件的开发流程、熟悉C语言5.熟练掌握MATLAB等数学仿真软件的应用
游戏测试工程师|软件测试工程师|软件测试开发工程师,时代我主宰后浪新视野-----讯锡科技-网易游戏项目2022届招聘讯锡科技自成立以来，一直致力为业界提供领先的解决方案、IT服务外包及咨询服务。公司已经在金融（银行、保险、证券、基金、信托等）、移动互联网、网络游戏、物流、医疗、政府、新零售与分销等领域积累了丰富的经验。讯锡科技凭借专业的交付能力，帮助客户在市场中赢得成功，并获得合作伙伴高度认可，通过了业界领先的质量与安全认证，包括CMMI-SVCLevel3、ISO27001、ISO9001:2008等。秉承“以人为本”的服务理念，一如既往的为客户提供优质、专业、高效的服务。并将持续履行我们的社会责任，为优秀的人才提供一个开放、平等、机会丰富的工作平台，帮助他们实现自身的价值。讯锡科技矢志成为世界级的IT咨询、服务及行业阶级方案提供商，为全球客户提供创新和值得信赖的服务。网易2001年正式成立在线游戏事业部，与广大游戏热爱者一同成长。经过近20年的快速发展，网易已跻身全球七大游戏公司之一。作为中国领先的游戏开发公司，网易一直处于网络游戏自主研发领域的前端。本次由讯锡公司进行招聘，为网易游戏项目组输送稳定高质量的人才，相信热爱的力量，有趣有创造力，追求自己所热爱的一切，时代我主宰、后浪新视野！招聘流程：宣讲会/双选会----简历投递----简历筛选----在线笔试----面试&offer发放----培训&入职招聘职位：游戏测试工程师---广州、杭州、上海职位描述：负责游戏项目的质量工作。您可以：1.加入国内最顶级的游戏研发团队，享受规范和优质的培训体系，获得飞速成长的机会；2.为不同的平台创造和开发世界一流的游戏，尤其是当前最热的移动平台；3.最先接触和体验一线游戏产品，并与优秀的测试团队一起剖析产品、制定和执行每个阶段的测试计划；4.全面详尽地对产品进行测试，找出各类bug，并协助研发工程师进行修复，直至问题得到彻底解决；5.深度体验游戏，钻研游戏的各种设计理念，将兴趣融入工作；职位要求：我们希望被推荐人是2022年毕业，全日制统招本科及以上学历，理工科专业尤佳，如果符合以下任两项条件会有加分：1.热爱游戏，立志投身于游戏行业；2.良好的沟通表达能力；3.喜欢发掘问题，并会想办法解决；4.扎实的计算机基础，至少掌握1门编程语言，有python等开发语言经验者尤佳；5.在游戏中作为大公会会长、参加过职业战队、电子竞技比赛获奖经历等。软件测试工程师---广州、杭州职位描述：1.加入国内最顶级的软件研发团队，享受规范和优质的培训体系，获得飞速成长的机会；2.对产品的需求进行分析，编写测试计划、执行测试用例，反馈报告问题并协助研发工程师修复bug；3.推动项目进度，改善相关流程提高测试的质量和效率；职位要求：我们希望被推荐人是2022年毕业，全日制统招本科及以上学历，理工科专业尤佳，如果符合以下任两项条件会有加分：1.有较好的逻辑思维；2.有较好的沟通能力和解决问题的能力；3.有较强的学习能力和责任心，能承受一定的工作压力；4.扎实的计算机基础，至少掌握1门编程语言，有python等开发语言经验者尤佳；软件测试开发工程师---杭州、上海职位描述：负责游戏项目的质量工作。您可以：1.加入国内最顶级的游戏研发团队，享受规范和优质的培训体系，获得飞速成长的机会；2.参与研发业内最先进的自动化测试框架和平台，推进行业技术革新；3.获得在网易游戏平台学习的机会，得到快速的成长；4.写代码破坏代码。通过测试工具的开发，流程进度的控制，帮助研发团队创造最强壮的系统；职位筛选要求：1.2022年毕业，计算机或相关专业，全日制统招本科及以上学历；2.较好的计算机基础，熟悉至少一门编程语言，了解数据结构、算法、操作系统和网络等知识；具有以下条件加分：1.有一定的软件开发经验；2.有一定的软件开发经验，且个人主要负责代码编写，简历中所开发内容有清晰描述;3.有游戏开发经历，对游戏引擎有一定的了解；4.热爱游戏，对游戏有一定的理解；工作地点：广州杭州上海三地均可选择薪资待遇：6K-9K元/月如果想让您的简历脱颖而出，来看这里：简历命名要求：意向城市-游戏/软件测试工程师-姓名格式要求：PDF简历必须包含但不限于以下方面：个人信息、求职意向、教育经历、项目经历、实习经历、游戏经历、专业技能、自我评价；求职意向：必须明确-游戏测试工程师、软件测试工程师必备信息：项目经验+游戏经历（种类+段位）游戏经历以罗列的形式呈现，非作文感想类；具体如下：游戏类型、游戏名称、游戏时长、游戏段位/等级（根据游戏类型不同可以说明人物等级、装备等级等）、充值金额、参赛名次等；补充信息：有校外实习/校内活动/竞赛等；（以上基本信息和必备信息，必须包含在简历中。补充信息则视同学实际情况进行填写。如有项目经历，具体内容请更新为用了哪些技术实现模块or解决问题等，另建议其添加技能描述一列，如语言+熟练程度及个人理解。）招聘联系方式（用于简历投递）招聘电话：17720531336027-87581718联系人：李女士简历投递邮箱：campus@
前端开发人员|资深前端开发人员,"因项目工作需要，招聘Web前端开发人员共3名，派遣至浙江大学图书馆CADAL项目管理中心工作。凡符合招聘岗位要求且有意向者，请将个人简历（包括学习、工作经历）以及其它证明本人能力的相关资料发至邮箱chuyi_ph@，主题请注明“岗位应聘姓名+”期间如有问题，请邮件联系。经考核后择优录取、待遇面议。截止时间：2021年5月25日咨询电话：0571-87951969（潘老师）杭州江南人才服务有限公司2021年5月10日岗位要求招聘单位招聘岗位职数招聘岗位及要求浙江大学图书馆CADAL项目管理中心web前端开发11、根据产品设计需求，配合后台开发人员实现产品界面和功能，开发及维护前端页面性能；2、制作或协助制作各种页面组件或页面模版；3、计算机行业优先任职资格：1.具有计算机相关专业2.熟悉Web标准，对MVC、HTML语义化等有较深刻理解；3.熟练试用jquery,熟悉使用主流前端框架，如react，vue；，有实际开发经验，熟悉webpack等构件工具4.熟悉移动端h5开发，了解各平台兼容性差异，具有Ajax，CSS，javascript开发经验5.对自己做过的项目，用过的方案有深入思考，最好简历里有所体现。6.对新技术有强烈的探索欲望，责任心强，善于团队合作，善于沟通分享，能够承受工作压力。7、熟练掌握EChart；8、熟悉使用源码版本管理git等；9、有高校教育相关行业经验者优先资深前端开发2资深前端开发1.有H5、小程序、Web、Node等技术的开发经验2.深入理解W3C标准与ES规范，熟悉Web语义化3.理解组件化开发思想，有一定的设计能力，熟悉MV*框架、熟练掌握Vue、Vuex等框架;4.主持攻坚解决各种疑难杂症，系统优化eh***.cn[点击查看]"
web前端开发,"职位描述：1、参与产品需求、研发设计的相关讨论，能快速理解业务需求；2、参与应用前端技术框架的设计、研发、迭代及维护；3.、协作前端开发人员解决常见的界面、布局、控件、交互等问题；4、关注用户体验，持续性能优化，实现极致的Web加载、执行和渲染优化；5、能与UI设计人员、后端开发人员等配合，进行有效的沟通任职要求：1、计算机等相关专业，本科及以上学历，可接受在校实习生和应届毕业生；2、熟悉互联网前端开发工作流程；3、熟悉Web标准，对MVC、HTML语义化等有较深刻理解；4、熟悉以JS,CSS和HTML为基础技术的主流框架、库和工具，了解其设计思想，包括但不限于React/Vue.JS/AngularJS生态，具有微信小程序开发使用过uniapp的优先；5、有良好的代码书写规范习惯，熟练使用小程序IDE，使用过Git代码管理仓库6、具备良好的沟通能力、学习能力，有良好的团队合作精神和高度的责任感；"
web前端开发|PHP工程师|网站运营,"作者：时间：2021-07-08邯郸市伯函网络科技有限公司是国内首批自主开发微信商城系统的企业,由我们研发的微信商城系统仅用2年时间,覆盖邯郸本土所有大型企业:赵王集团、安居集团、万冠国际、湘君府味业、金狮麟酒店等等,河北省其他各市均有我们开发系统的代理商。招聘岗位01web前端开发1人4k-8k/月职位要求：1.具有2年以上工作经验2.熟练DIVCSS布局,flex布局精通HTML、javascript,vuejs3.精通HTML5/CSS3、Bootstarp、jQuery等Web开发相关技术4.熟悉vueJs全家桶。5.对多终端适配、webapp开发有实践经验者；6.有小程序实际开发经验7.有uni-app框架实际开发经验优先考虑02PHP工程师1人4k-5k/月精通PHP编程语言；熟练使用Mysql数据库；熟练掌握HTML，CSS，JavaScript；熟悉Jquery框架（至少一种JS框架）；熟悉ThinkPHP框架（至少一种PHP框架）；任职要求：善于沟通，有良好的团队合作精神和高度的责任感，有创新精神，保证工作质量；有良好的职业道德，学习能力强，责任心强。：03网站运营1人面议工作内容：1.58黄页，发布广告，刷新，更新内容，设置精品，效果跟进，跟58客服联系如何更好的有效果，每日运营情况结果反馈销售经理2.抖音短视频，文案搜集整理剪辑发布，每天至少1-2条，抖音预约用户筛选简历，回访，站长的培训与维护，每日维护情况反馈销售经理3.销售部人员的工作情况、任务的完成核对整理总结，每日反馈给销售经理4.新入职员工，产品基础知识的培训，基本情况反馈5.负责各大营销平台创业文章帖子的发布，完成量需要反馈6.抖音预约会员的培训与维护，完成量反馈7.领导交代的其他工作职位要求：有市场运营工作经验优先福利待遇周末双休交通补助加班补助饭补话补员工聚餐外出旅游联系方式招聘邮箱：1462252176@公司地址：河北省邯郸市丛台区滏西大街2号滨河世纪大厦"
